Content,Metadata
"1- Open jdk-11 indirilir. sudo apt update sudo && apt install openjdk-11-jdk 2- JAVA_HOME environment variable'ı ayaralanır. /usr/lib/jvm/ dizini altında java-1.x.x-openjdk bulunur ve not edilir. ""vim /etc/profile"" veya ""vim ~/.bashrc"" ile dosyaları açılıp dosyanın sonuna alttaki kısımlar eklenir. export JAVA_HOME= ""/usr/lib/jvm/ java-1.x.x-openjdk "" export PATH=$JAVA_HOME/bin:$PATH Düzenlediğiniz dosyaya göre ""source /etc/profile"" veya ""source ~/.bashrc"" yapılır. 3- https://wso2.com/api-manager/# sayfası üzerinden ""TRY IT NOW"" a tıklanarak açılan pencerede mail adresinizi girerek Zip Archive olarak dosyayı indiriniz. 4- <Dosya'nın dizini>/repository/conf/deployment.toml dosyasındaki hostaname kısmı sunucu ip'si ile değiştirilir. Exp: [server] hostname = ""192.168.1.110"" 5- WSO2 servisi ayarlanır. vim /etc/systemd/system/wso2.service Aşağıda verilenler yazılır değişkenler indirdiğiniz dosya dizini ve çalıştırmak istediğiniz kullanıcıya göre düzenlenir. 1 2 3 4 5 6 7 8 9 10 11 12 13 14 15 16 17 18 19 20 21 22 23 24 25 26 27 28 29 30 31 32 33 34 35 36 37 38 39 40 # For usage with systemd # On Ubuntu: # install by running sudo systemctl enable <absolute path>/wso2esb.service # start by running sudo systemctl start wso2esb.service # stop by running sudo systemctl stop wso2esb.service # check status by running systemctl status wso2esb.service [ Unit ] Description = WSO2 # If network requirement is not specified, the esb can slow down shutdown # of the system because of timeouts towards the RDBMS running on another # server or other dependent remote components. Requires = network - online . target After = network - online . target [ Service ] # The Type=simple approach is not safe: if a user starts the server using the # wso2server.sh script, systemd doens't know about it and another instance will # be started when 'systemctl start wso2esb' is executed if the server is still running. # Type=simple # ExecStart=CARBON_HOME/bin/wso2server.sh Environment = "" /usr/lib/jvm/ java-1.x.x-openjdk "" # Can optionally be set, but the wso2server.sh script determines it automatically # Cannot be used within this unit file for variable substitution # CARBON_HOME = /opt/wso2/wso2esb/wso2esb-5.0.0 Type = forking # Use WSO2 PID file -> this allows to still use wso2server.sh start|stop commands # directly from command line in combination with systemctl. 'Systemctl status' will # not detect that wso2server.sh start has been executed directly, but will correctly # stop the server when the system is shutdown or 'systemctl stop' is executed. Systemctl # will also not start another instance of the server when 'systemctl start' is executed. PIDFile =/home/wso2/wso2_setup/wso2am-4.1.0 / wso2carbon . pid ExecStart =/home/wso2/wso2_setup/wso2am-4.1.0/bin/api-manager.sh start ExecStop =/home/wso2/wso2_setup/wso2am-4.1.0/bin/api-manager.sh stop User = wso2 [ Install ] WantedBy = multi - user . target systemctl daemon-reload systemctl status wso2.service systemctl enable wso2.service systemctl start wso2.service 6- Servisinizin çalıştığını  https://<sunucu-ip>:9443 adresine giderek kontrol edebilirsiniz.Screen Shot 2022-09-27 at 11.14.53.png","{'title': 'WSO2 Kurulum', 'id': '62397732', 'source': 'https://wiki.softtech.com.tr/display/SDO/WSO2+Kurulum'}"
"DevopsSofttech (DS) uygulaması taranacak Projeleri genomdan otomatik çekerek checkmarkx taraması başlatır ya da uygulama ekranından proje bilgisi aratılarak da tarama başlatılabilir. Ancak DS de proje yoksa  mesela third-party için Checkmarkx'a harici bir projeyi de tara diyebiliriz, bunun için projenin Repo bilgisi (mesela , https://scoretfs.isbank/ISBANK/ ...) ve repoya erişim için kullanıcı yetkisi verilmesi lazım, bu bilgileri ile checkmarksta yeni bir proje yaratarak tarama başlatılabilir. Manuel yeni tarama projesi yaratmak için 1- Menüden Projects&Scans => Create New Project Açılan ekranda projeye bir isim verilir. Present değeri default bırakılabilir ya da Spesifik bir tarama sorgusu seçebilirsiniz mesela Android . 2- Click < Next > Daha Sonra Source Control seçilir. Projenin reposu ve credential bilgileri girilir. Test connection success olduğu görülür. Eğer Local seçilirse soruce dosyasını zip olarak 200MB a kadar proje ekleyebilirsin. 3- Click < Next > Now olarak default seçili zaten 4- Click < Next > Post-Scan kutucuğuna Tarama sonrası e-postayı şuraya gönder diyebilirsin. ve Finish diyip kapatabilirsin. Tarama bittikten sonra ayrıca Menüden => All Scan ile tüm taramaları listeleyip (dilersen Filters ile PROJECT adı kısmandan aratabilirsin) => Action kolonunda bulunan Create Reporta tıklayarak, => Açılan pencerede Generate Report ile dosyayı indirebilirsin.image2022-10-17_16-32-43.pngimage2022-10-17_16-32-20.pngimage2022-10-17_16-31-32.pngimage2022-10-17_16-21-47.pngimage2022-10-17_15-58-1.pngimage2022-10-17_15-56-4.png","{'title': 'Manuel Proje Reposu Taratma ve Raporu <third-party>', 'id': '62400632', 'source': 'https://wiki.softtech.com.tr/pages/viewpage.action?pageId=62400632'}"
"Q_ NexusIQ Jenkins tarama pipeline'ında (Softtech Projeleri için)  Gradle hatasından tarama yapılamıyor. http://10.80.36.112:8080/view/nexusiq Jenkins makinasında build hata verenlerin Gradle versiyonunu indirip https://services.gradle.org/distributions/ 10.80.36.112 makinasında C:\CustomGradleRepo dizine kopyalamak gerekli. Q_ Genomda Banka paketini manuel nasıl guncellerim ? Saatte bir çalışan CheckmarxJobs. CreateCheckmarxProjects hangdire jobı ile yeni projelerin Genomdan DevopsSofttech 'e akması sağlanır ancak bu servis hata alırsa manuel müdahale için https://devops.softtech/backend/api/CxSecure/ChangeCheckmarxProjectRepoWithAciCode?aciCode=ACI70145 ile hızlıca genomda ki proje yaratılır, Ardından devops Softtech üzerinden tarama başlatırılır. Q_ Checkmarx taramaları nerden trigger ediliyor ? DevopsSofttech te projeler Bnka Projeleri ve Rally(Softtech) olarak ikiye ayrılıyor. İki farklı sayfadan yönetiliyor. Portal üstünden tarama başlatılabiliyor ayrıca, Banka projeleri Checkmarx taraması =>DevopsSofttech üzerinden Hangfire jobları ile schedule olarak tetikleniyor.( http://10.80.36.89:8081/hangfire ) NexusIQ taraması => Paket deploy olurken (Banka sürüm ekibinin kontrolündeki XLRelease 'de bir adım altından) ScoreTFS altındaki SOFTWARE_QA adındaki pipeline ile tetikleniyor  ( https://scoretfs.isbank/ISBANK/SOFTWARE_QA/_build ) Rally projeleri Checkmarx taraması ve NexusIQ taraması Jaynı yerden Jenkins pipeline dan tetikleniyor, Label olarak ayrıldı. ( http://10.80.36.112:8080/ ) Q_ Checkmarx taramasında aynı repo altında multi-ACI oldugunda diğer paketlerin trend değeri guncellenir mi ? => Evet ,  ""UpdateSameRepoProjectsInformation"" jobı ile aynı repo altındaki paketlerin en son taranan ACI'ın trend değeri ile trend değerleri güncellenir Böylece diğer ACI'lar için ayrıca tarama başlatmaya gerek yoktur. Q_Bazı projeler Checkmarx taramasında hata alıyor. Exclude edilen projeleri nerden görebilirim ? select * from ExcludedCheckmarxProject where AciCode = 'ACI70212' Q_Hangi projeleri Exclude etmeliyim? select * from SystemConfiguration where ConfigurationName = 'ExcludedChekmarxProjects' ; Genom servisinden paketin config bilgisine erişip, aşağıdakiler için kodda zaten paketi devops.softtech te yaratırken exclude ediyor. Ayrıca Istisna olarak tanıntılması gereken paketler için mail ile talep ediliyor. External DataPower Config; Container Base Image; Openshift Project; IDEA Service Version; Q_Ben manuel tarama yaptım ama Ds de release statusu hala çarpı görünüyor nasıl güncelleyebilirim. => Hemen yansıması için, Get last scan and insert DB apisini postman den çalıştır. https://devops.softtech/backend/background/jobs/getLastScanAndInsertToDb?aciCode=ACI69900 Q_Harici bir projeyi nasıl taratırım => wiki de Checkmarx altında , Manuel Proje Reposu Taratma ve Raporu  sayfası. Q_Checkmarx uygulması dondu, Hangfire jobları calısmadı ne yapmalıyım. => 10.80.36.89 sunuya login olup, IIS full restart yapılır. Q_Git clone failed hatası gelediğinde ne yapmalıyım? => Git clone failed: repository ' https://******:******@scoretfs.isbank/ISBANK/ROBOTIKP/_git/bkkob-amex-outgoing-mutabakat-robotu/ ' not found Hatası geldiğinde önce Genomdan guncel repoyu kontrol et.  Müşteriden güncel repo bilgisi alıp karsılaştır, Eğer farklı ise GENOM da repo bilgisini güncellemeleri için mail at. Q_Citrix makinasını talebi nasıl alınır? 1. Sanal makine talebi yapabilmek için maximo üzerinden ""Softtech Citrix Erişim Talebi Formu"" na erişmemiz gerekmektedir. Maximo üzerinden bu forma talep açabilmek için öncelikle LDAP grubuna eklenmemiz gerekmektedir. 2. LDAP grubuna eklenmek için http://kimlik.isbank sayfasına giriş yapmanız, sonrasında Yeni Bir Talepte Bulun/Oracle LDAP grup işlemleri/Gruba Eklenme/Atama kısmına tıklanarak “SOFTCTRX” ldap grubu seçilirek talebi onaya göndermeniz gerekmektedir. 3. LDAP Grubuna eklenme işlemi tamamlandıktan sonra maximo üzerinden (Maximo Linki: Welcome (ism.isbank)), ""Softtech Citrix Erişim Talebi"" formunu görebiliyor olacaksınız. Bu alan üzerinden talebinizi açıklayarak yönetici onayına göndermeniz gerekmektedir. 4. Talebiniz onaylandıktan sonra https://virtual.isbank.com.tr/Citrix/multifactorWeb/ sayfasından citrix sanal makineye erişilebilmektedir. Q_ Sanal Makina geldi ama ilk defa bağlanırken sorun yaşıyorum. Desktop'a tıklayınca indirilen *.ica uzantılı dosyası aşağıdaki linkteki yönergeleri izleyerek Citrix ile açmalısınız. https://support.citrix.com/article/CTX804493/users-prompted-to-download-run-open-ica-file-instead-of-launching-connection - Q_ Twislock nasıl erişebilirim. Ancak sanal makineye erişmeniz Twistlock bulgularının raporladığı Prisma uygulamasına erişmeniz için yeterli olmamaktadır. Sanal Makine üzerinden twistlock bulgularına erişmek için ek firewall talebi yapmanız gerekmektedir. Firewall talebinizi Maximo üzerinden ""Network Erişimi Firewall Tanımı"" alanı üzerinden yapmanız gerekmektedir. Tanım içerisinde bilgileri aşağıda belirtilen şekilde giriş yapmanız gerekmektedir. • Ortam: Production • Kaynak IP Adresi: Kendi IP Adresinizi yazmanız gerekmektedir. • Hedef IP Adresi: 10.192.99.199 • Hedef Alan: https://twistlock-console.apps.vega.kube.isbank (Talep içerisinde belirtebilirsiniz.) • Port/Servis: HTTP/HTTPS WEB erişimi (tcp/80,tcp/443) • Geçerli Olması Gereken Süre: 3 Yıl Talebiniz tamamlandıktan sonra citrix sanal makine üzerinden İşbank sicilinizi “ISBANK\xxxxxxx” formatında girerek link üzerinden Prisma Cloud (kube.isbank) erişim sağlayabilirsiniz.image-2023-1-13_0-45-4.pngimage-2023-1-13_0-44-44.pngimage-2023-1-12_14-19-5.pngimage-2023-1-12_14-17-50.pngimage-2022-11-21_19-45-14.pngimage-2022-11-21_19-44-24.pngimage2022-10-20_9-23-51.png","{'title': 'Ne yapmalıyım ?', 'id': '62400981', 'source': 'https://wiki.softtech.com.tr/pages/viewpage.action?pageId=62400981'}"
"Panel Softtech üzerinde tutulan defect sayılarını Mirket üzerinden yeni veriler manuel olarak postman üzerinden  GovernanceController daki SetFunctionalDefects  ile yapılır. Ama bu işlem manuel yapılır. herhangi bir job ya da otomasyon yok. TEST OTOMASYON jobları : DevopsSofttech üzerinden DB ve API aracı olarak kullanılır. backgroundJob.Start(""GetMochaScenarios"", Cron.Daily(0, 0), () => mochaJobs.GetMochaScenarios(), ""mocha""); backgroundJob.Start(""GetMochaActions"", Cron.Daily(0, 0), () => mochaJobs.GetMochaActions(), ""mocha""); backgroundJob.Start(""GetMochaRuns"", Cron.Daily(0, 0), () => mochaJobs.GetMochaRunResults(), ""mocha""); Senaryo&Defect Sayıları(Banka) - Panel.Softtech https://jira.isbank/confluence/display/TOY/Panel+verilerinin+olusturulmasi için yetki jira.isbank ve confluence yetkisi gerekebilir.image2022-10-24_11-29-19.png","{'title': 'Panel.Softtech ilişkisi', 'id': '62401332', 'source': 'https://wiki.softtech.com.tr/pages/viewpage.action?pageId=62401332'}"
"Screen Name Json Main object DataType CI Image ""image"": ""scorenexus.isbank:9443/cashflow-platform/cashflow-platform:0.1.107"", ""entityInfo"": {""instances"": [ { ""image"": ""scorenexus.isbank:9443/cashflow-platform/cashflow-platform:0.1.107"", ""host"": ""KLTFSBDA02"", ""modified"": ""2022-11-17T14:02:49.552Z"", ""tag"": ""0.1.107"", ""repo"": ""cashflow-platform/cashflow-platform"", ""registry"": ""scorenexus.isbank:9443"" }, Json: Array Host ""host"": ""KLTFSBDA02"", ""entityInfo"": { Json: Array Project ? Build ? Vulnerabilities ""critical"": 99, ""high"": 525, ""medium"": 624, ""low"": 121, ""total"": 1369 ""entityInfo"": {  ""vulnerabilityDistribution"": { ""critical"": 0, ""high"": 0, ""medium"": 2, ""low"": 0, ""total"": 2 }, Risk Factors ? Scan Time ""scanTime"": ""2022-11-17T14:02:49.552Z"", Status ? Collection ? CI- Image Details Image ""image"": ""scorenexus.isbank:9443/cashflow-platform/cashflow-platform:0.1.107"", ""entityInfo"": {""instances"": [ { ID ""id"": ""b4c3aaaec6c68088f0ab152d7f4e571c91b6623dfc18ef1a98e96be95eceb7ed"", ""entityInfo"": { OS Distribution ""distro"": ""CentOS Linux release 7.6.1810 (Core)"", ""entityInfo"": { OS Release ""osDistroRelease"": ""RHEL7"", ""entityInfo"":  { Tags ""tags"": [ { ""tag"": ""latest"" ""entityInfo"": { ""tags"": [ Scan Staus ""vulnFailureSummary"": ""Scan failed due to vulnerability policy violations: block-critical, 1 vulnerabilities, [critical:1]"", if ""pass"": false pass: false, CI- Vulnerabilities Type ""type"": ""image"", ""vulnerabilities"": [] Highest Severity ""severity"": ""high"", ""vulnerabilities"": [] Description ""description"": ""The Hashicorp go-gette "", ""vulnerabilities"": [] Fix status status: ""fixed in 1.0.7"" ""vulnerabilities"": [] CVE ""cve"": ""CVE-2021-23343"" Packages ""packageName"": ""path-parse"", Package Version ""packageVersion"": ""1.0.0"", Vulnerability Link link: "" https://nvd.nist.gov/vuln/detail/CVE-2020-7754 "" CI- Compliance ID ""id"": 425, ""complianceIssues"": [] Category ? Aşağı görseli konmuştur. Severity ""severity"": ""high"", ""complianceIssues"": [] Description ""title"": ""Private keys stored in image"", ""complianceIssues"": [] Screen Name Json Main object DataType CD- Deployed Registry ""registry"": ""scorenexus.isbank:9443"", ""instances"": [ { ""image"": ""scorenexus.isbank:9443/ai-h2o-dai/ai-h2o-driverless-ai-1.9.0.6:latest"", ""host"": ""workergpu9.vega.kube.isbank"", ""modified"": ""2022-11-17T13:23:16.101Z"", ""tag"": ""latest"", ""repo"": ""ai-h2o-dai/ai-h2o-driverless-ai-1.9.0.6"", ""registry"": ""scorenexus.isbank:9443"" } ], Json: Array Repository ""repo"": ""ai-h2o-dai/ai-h2o-driverless-ai-1.9.0.6"", instances Json: Array Tag ""tag"": ""latest"" instances Json: Array Host ""host"": ""workergpu9.vega.kube.isbank"", instances Json: Array Clusters ""vega"" ""clusters"": [ ""vega"" ], Json: Array Apps ? Vulnerabilities ""critical"": 99, ""high"": 525, ""medium"": 624, ""low"": 121, ""vulnerabilityDistribution"": { ""critical"": 99, ""high"": 525, ""medium"": 624, ""low"": 121, ""total"": 1369 }, Risk Factors ? Collections ? Pass pass: true CD Image Details Image ""image"": ""scorenexus.isbank:9443/ai-h2o-dai/ai-h2o-driverless-ai-1.9.0.6:latest"", ""instances"": [ { ""image"": ID ""id"": b4c3aaaec6c68088f0ab152d7f4e571c91b6623dfc18ef1a98e96be95eceb7ed"", ""id"" OS Distribution ""distro"": ""CentOS Linux release 7.6.1810 (Core)"", ""distro"" OS Release ""osDistroRelease"": ""RHEL7"", ""osDistroRelease"" Diggest ""repoDigests"": [ ""scorenexus.isbank:9443/ai-h2o-dai/ai-h2o-driverless-ai-1.9.0.6@sha256:753933e9812a4b28fad59c9cf6c4747399496b70ec8a84d1386749a1fd35e06a"" ], ""repoDigests"":[] Tag ""tag"": ""latest"" instances CD Vulnerabilities Type ""type"": ""image"", ""vulnerabilities"": [] Highest Severity ""severity"": ""high"", ""vulnerabilities"": [] Description ""description"": ""The Hashicorp go-gette "", ""vulnerabilities"": [] CD Compliance ID ""id"": 425, ""complianceIssues"": [] Category ? Severity ""severity"": ""high"", ""complianceIssues"": [] Description ""title"": ""Private keys stored in image"", ""complianceIssues"": []","{'title': 'Prisma (Twsitlock) Entegrasyonu', 'id': '71630984', 'source': 'https://wiki.softtech.com.tr/display/SDO/Prisma+%28Twsitlock%29+Entegrasyonu'}"
,"{'title': 'ÇKB_Analiz Yetkinlik Hattı', 'id': '72548402', 'source': 'https://wiki.softtech.com.tr/pages/viewpage.action?pageId=72548402'}"
,"{'title': 'Yetkinlik Hattı Konseyi (Kasım Ayı) Toplantı Notları', 'id': '76120381', 'source': 'https://wiki.softtech.com.tr/pages/viewpage.action?pageId=76120381'}"
"jira.softtech.com.tr Örnek Jira kaydı , SubCategory de Checkmarx seçilir.image-2023-1-5_14-52-5.png","{'title': 'Jira kaydı açma', 'id': '77727367', 'source': 'https://wiki.softtech.com.tr/pages/viewpage.action?pageId=77727367'}"
